Manufacturer,Registrations,Date,Category
ASHOK LEYLAND LTD,3,2024-01-01,FOUR WHEELER
ASTON MARTIN LAGONDA LTD,15,2024-01-01,FOUR WHEELER
AUDI AG,501,2024-01-01,FOUR WHEELER
AUTOMOBILI LAMBORGHINI S.P.A,96,2024-01-01,FOUR WHEELER
BAJAJ AUTO LTD,52,2024-01-01,FOUR WHEELER
BENTLEY MOTORS LIMITED,64,2024-01-01,FOUR WHEELER
BMW INDIA PVT LTD,14327,2024-01-01,FOUR WHEELER
BYD AUTO,2,2024-01-01,FOUR WHEELER
BYD INDIA PRIVATE LIMITED,2709,2024-01-01,FOUR WHEELER
CHEVROLET SALES INDIA PVT LTD,1,2024-01-01,FOUR WHEELER
DAIMLER AG,2,2024-01-01,FOUR WHEELER
DAIMLER INDIA COMMERCIAL VEHICLES PVT. LTD,2,2024-01-01,FOUR WHEELER
DALIAN FORKLIFT CO.,1,2024-01-01,FOUR WHEELER
DODGE MOTORS,3,2024-01-01,FOUR WHEELER
FCA INDIA AUTOMOBILES PRIVATE LIMITED,4597,2024-01-01,FOUR WHEELER
FERRARI INDIA PRIVATE LIMITED,7,2024-01-01,FOUR WHEELER
FERRARI SPA,10,2024-01-01,FOUR WHEELER
FERRARI SPA (IMPORTER:NAVNIT MOTORS PVT LTD),9,2024-01-01,FOUR WHEELER
FERRARI SPA (IMPORTER:SELECT CARS P LTD),8,2024-01-01,FOUR WHEELER
FORCE MOTORS LIMITED,1980,2024-01-01,FOUR WHEELER
FORD INDIA PVT LTD,20,2024-01-01,FOUR WHEELER
GENERAL MOTORS INDIA PVT LTD,4,2024-01-01,FOUR WHEELER
HERO HONDA MOTORS LTD,1,2024-01-01,FOUR WHEELER
HERO MOTOCORP LTD,2,2024-01-01,FOUR WHEELER
HINDUSTAN MOTOR CORPORATION,2,2024-01-01,FOUR WHEELER
HINDUSTAN MOTOR FINANCE CORPORATION LIMITED,1,2024-01-01,FOUR WHEELER
HONDA CARS INDIA LTD,66930,2024-01-01,FOUR WHEELER
HONDA MOTORCYCLE AND SCOOTER INDIA (P) LTD,8,2024-01-01,FOUR WHEELER
HYUNDAI MOTOR INDIA LTD,540590,2024-01-01,FOUR WHEELER
"HYUNDAI MOTORS LTD, SOUTH KOREA",7,2024-01-01,FOUR WHEELER
INDIA KAWASAKI MOTORS PVT LTD,1,2024-01-01,FOUR WHEELER
INDIA YAMAHA MOTOR PVT LTD,11,2024-01-01,FOUR WHEELER
ISUZU MOTORS INDIA PVT LTD,529,2024-01-01,FOUR WHEELER
JAGUAR LAND ROVER INDIA LIMITED,4688,2024-01-01,FOUR WHEELER
JSW MG MOTOR INDIA PVT LTD,51968,2024-01-01,FOUR WHEELER
KAISER WILLYS JEEP,2,2024-01-01,FOUR WHEELER
KIA INDIA PRIVATE LIMITED,233115,2024-01-01,FOUR WHEELER
KIRAN AGRO EQUIPMENTS,1,2024-01-01,FOUR WHEELER
LAMBORGHINI,1,2024-01-01,FOUR WHEELER
LEXUS MOTORS LTD,5,2024-01-01,FOUR WHEELER
MAHINDRA DEFENCE SYSTEMS LTD,1,2024-01-01,FOUR WHEELER
MAHINDRA LAST MILE MOBILITY LTD,3,2024-01-01,FOUR WHEELER
MAHINDRA & MAHINDRA LIMITED,468615,2024-01-01,FOUR WHEELER
MAHINDRA & MAHINDRA LIMITED (TRACTOR),1,2024-01-01,FOUR WHEELER
MARUTI BHIWANI E AUTOMOBILES,1,2024-01-01,FOUR WHEELER
MARUTI INDUSTRIES,5,2024-01-01,FOUR WHEELER
MARUTI SUZUKI INDIA LTD,1427156,2024-01-01,FOUR WHEELER
MARUTI UDYOG LTD,195,2024-01-01,FOUR WHEELER
MASERATI S.P.A,16,2024-01-01,FOUR WHEELER
MAURYA MOTORS PVT LTD,1,2024-01-01,FOUR WHEELER
MCLAREN AUTOMOTIVE (IMPORTER: INFINITY CARS),19,2024-01-01,FOUR WHEELER
MERCEDES -BENZ AG,1429,2024-01-01,FOUR WHEELER
MERCEDES-BENZ INDIA PVT LTD,15739,2024-01-01,FOUR WHEELER
MORRIS MOTORS LTD,1,2024-01-01,FOUR WHEELER
"M/S PATEL & SONS ENGINEERING WORKS,SAMBALPUR",1,2024-01-01,FOUR WHEELER
NISSAN MOTOR INDIA PVT LTD,26173,2024-01-01,FOUR WHEELER
OTHERS,433,2024-01-01,FOUR WHEELER
PCA AUTOMOBILES INDIA PVT LTD,5161,2024-01-01,FOUR WHEELER
PIAGGIO VEHICLES PVT LTD,4,2024-01-01,FOUR WHEELER
PORSCHE AG GERMANY,869,2024-01-01,FOUR WHEELER
PRIYAM INDUSTRIES AND ENGINEERING PVT LTD,3,2024-01-01,FOUR WHEELER
RENAULT INDIA PVT LTD,40055,2024-01-01,FOUR WHEELER
ROLLS ROYCE,3,2024-01-01,FOUR WHEELER
ROLLS-ROYCE MOTOR CARS(IMPORTER:SELECT CARS P LTD),26,2024-01-01,FOUR WHEELER
ROLLS ROYCE MOTOR (IMPORTER: KUN MOTOR),28,2024-01-01,FOUR WHEELER
ROYAL-ENFIELD (UNIT OF EICHER LTD),3,2024-01-01,FOUR WHEELER
SKODA AUTO AS,87,2024-01-01,FOUR WHEELER
SKODA AUTO INDIA PVT LTD,3,2024-01-01,FOUR WHEELER
SKODA AUTO VOLKSWAGEN INDIA PVT LTD,79258,2024-01-01,FOUR WHEELER
SML ISUZU LTD,99,2024-01-01,FOUR WHEELER
SUZUKI MOTORCYCLE INDIA PVT LTD,4,2024-01-01,FOUR WHEELER
SWARAJ AUTOMOTIVES LTD,1,2024-01-01,FOUR WHEELER
TATA MOTORS LTD,1712,2024-01-01,FOUR WHEELER
TATA MOTORS PASSENGER VEHICLES LTD,465561,2024-01-01,FOUR WHEELER
TATA PASSENGER ELECTRIC MOBILITY LTD,55197,2024-01-01,FOUR WHEELER
TENAX INTERNATIONAL (IMPORTER: VERT EQUIPMENT),1,2024-01-01,FOUR WHEELER
TORK MOTORS PVT LTD,1,2024-01-01,FOUR WHEELER
TOYOTA HIACE GL COMMUTER,2,2024-01-01,FOUR WHEELER
TOYOTA KIRLOSKAR MOTOR PVT LTD,239939,2024-01-01,FOUR WHEELER
TVS MOTOR COMPANY LTD,12,2024-01-01,FOUR WHEELER
VE COMMERCIAL VEHICLES LTD,89,2024-01-01,FOUR WHEELER
VINTAGE VEHICLES,28,2024-01-01,FOUR WHEELER
VOLKSWAGEN AG,1,2024-01-01,FOUR WHEELER
VOLKSWAGEN INDIA PVT LTD,3,2024-01-01,FOUR WHEELER
VOLTAS LIMITED,1,2024-01-01,FOUR WHEELER
VOLVO AUTO INDIA PVT LTD,1847,2024-01-01,FOUR WHEELER
"""VOLVO GROUP INDIA PVT LTD""",1,2024-01-01,FOUR WHEELER
WILLYS INDIA LTD,1,2024-01-01,FOUR WHEELER
XYZ1,2,2024-01-01,FOUR WHEELER
A-1 SUREJA INDUSTRIES,8,2024-01-01,TWO WHEELER
ABZO MOTORS PVT LTD,68,2024-01-01,TWO WHEELER
ADISHWAR AUTO RIDE INDIA PVT LTD,246,2024-01-01,TWO WHEELER
ADRIS ELECTRIC PVT LTD,8,2024-01-01,TWO WHEELER
AFTEK MOTORS INDIA PVT LTD,39,2024-01-01,TWO WHEELER
ALTIUS EV TECH PVT LTD,19,2024-01-01,TWO WHEELER
AMO MOBILITY SOLUTIONS PVT LTD,122,2024-01-01,TWO WHEELER
AMPERE VEHICLES PRIVATE LIMITED,1089,2024-01-01,TWO WHEELER
ANCHI MOTORCYCLE (IMPORTER: ECOTRINITY AUTOMOBILE,34,2024-01-01,TWO WHEELER
ANCHI MOTORCYCLE (IMPORTER: EVNEXUS PVT. LTD.),4,2024-01-01,TWO WHEELER
ANCHI MOTORCYCLE(IMPORTER:GREEN FUEL ALTERNATIVES),8,2024-01-01,TWO WHEELER
ANCHI MOTORCYCLE (IMPORTER: YED ELECTRIC),42,2024-01-01,TWO WHEELER
ANVITA AUTO TECH WORKS PVT LTD,5,2024-01-01,TWO WHEELER
ASHNNI MOTORS PVT LTD,5,2024-01-01,TWO WHEELER
ATHER ENERGY LTD,126359,2024-01-01,TWO WHEELER
ATUMOBILE PVT LTD,34,2024-01-01,TWO WHEELER
AYAAN ELECTRONIC PVT LTD,30,2024-01-01,TWO WHEELER
BAILI MOTOR (IMPORTER:A B MOTOSS EV PVT LTD),6,2024-01-01,TWO WHEELER
BAJAJ AUTO LTD,2185518,2024-01-01,TWO WHEELER
BATTRE ELECTRIC MOBLITY PVT LTD,3102,2024-01-01,TWO WHEELER
BENLING INDIA ENERGY AND TECHNOLOGY PVT LTD,525,2024-01-01,TWO WHEELER
BGAUSS AUTO PRIVATE LIMITED,18033,2024-01-01,TWO WHEELER
BLIX CYCLES AND E-VEHICLES PVT LTD,6,2024-01-01,TWO WHEELER
BMW INDIA PVT LTD,6911,2024-01-01,TWO WHEELER
BOOMA INNOVATIVE TRANSPORT SULUTIONS PVT LTD,851,2024-01-01,TWO WHEELER
BOUNCE ELECTRIC 1 PVT LTD,6972,2024-01-01,TWO WHEELER
BRB MEXICO S.A DE C.V,1,2024-01-01,TWO WHEELER
BSA MOTORS,1,2024-01-01,TWO WHEELER
BU4 AUTO PVT LTD,1,2024-01-01,TWO WHEELER
CHANDANA CORPORATION,164,2024-01-01,TWO WHEELER
CHETAK TECHNOLOGY LIMITED,4,2024-01-01,TWO WHEELER
CHINA HAOCHEN (IMPORTER: ADMS MARKETING),336,2024-01-01,TWO WHEELER
CHINA HAOCHEN (IMPORTER:SLSR ELECTRO),23,2024-01-01,TWO WHEELER
CHONGQING CHARMING (IMPORTER: AYAAN ELECTRONICS).,1,2024-01-01,TWO WHEELER
CLASSIC (INDIA) MOTORS,1,2024-01-01,TWO WHEELER
CLASSIC LEGENDS PVT LTD,33006,2024-01-01,TWO WHEELER
DAO EVTECH PRIVATE LIMITED,80,2024-01-01,TWO WHEELER
DONGMA VEHICLE (IMPORTER: MERCURY METALS),8,2024-01-01,TWO WHEELER
DUCATI INDIA PVT LTD,368,2024-01-01,TWO WHEELER
DUCATI MOTOR HOLDING S.P.A,1,2024-01-01,TWO WHEELER
DURGA FILTERS PVT LTD,5,2024-01-01,TWO WHEELER
E-ASHWA AUTOMOTIVE (HS 2W) PVT LTD,1,2024-01-01,TWO WHEELER
ECOBIT INTERNATIONAL(IMPORTER: JHEV MOTORS),59,2024-01-01,TWO WHEELER
ECO FUEL SYSTEMS (I) PVT LTD,192,2024-01-01,TWO WHEELER
EICHER MOTORS LTD,1,2024-01-01,TWO WHEELER
ELECTRECA VEHICLES,40,2024-01-01,TWO WHEELER
ELECTRIC ALLIANCE(IMPORTER: ELLYSIUM AUTOMOTIVES),5,2024-01-01,TWO WHEELER
ELEGO MOTORS PVT LTD,29,2024-01-01,TWO WHEELER
ELTHOR ENERGY PRIVATE LIMITED,203,2024-01-01,TWO WHEELER
ENGTIAN ELECTRIC BIKE PVT LTD,458,2024-01-01,TWO WHEELER
ENIGMA AUTOMOBILES PVT LTD,16,2024-01-01,TWO WHEELER
E ROYCE MOTORS INDIA PVT LTD,1,2024-01-01,TWO WHEELER
ESCORTS CONSTRUCTION EQUIPMENT LTD,3,2024-01-01,TWO WHEELER
ESCORTS R&D CENTRE,3,2024-01-01,TWO WHEELER
E-SPRINTO GREEN ENERGY PVT LTD,882,2024-01-01,TWO WHEELER
ESSEL ENERGY INFRA PVT LTD,3,2024-01-01,TWO WHEELER
EVTRIC MOTORS PVT LTD,135,2024-01-01,TWO WHEELER
EXERVAL PVT LTD,14,2024-01-01,TWO WHEELER
FIADO INDUSTRIES PVT LTD,60,2024-01-01,TWO WHEELER
FSTMOTO (IMPORTER: AUTOICARE INNOVATION),22,2024-01-01,TWO WHEELER
FSTMOTO INTERNATIONAL (IMPORTER: TEDI (INDIA)),2,2024-01-01,TWO WHEELER
FUJIYAMA POWER INFRA PVT. LTD.,101,2024-01-01,TWO WHEELER
GAURA ELECTRIC VEHICLES PVT LTD,437,2024-01-01,TWO WHEELER
GODAWARI ELECTRIC MOTORS PVT LTD,750,2024-01-01,TWO WHEELER
GOGORO INDIA PVT LTD,115,2024-01-01,TWO WHEELER
GOLDENLION (IMPORTER:ELLYSIUM AUTOMOTIVES PVT LTD),1,2024-01-01,TWO WHEELER
GOREEN E-MOBILITY PVT LTD,1372,2024-01-01,TWO WHEELER
GREAVES ELECTRIC MOBILITY PVT LTD,35059,2024-01-01,TWO WHEELER
GUANGDONG TAYO (IMPORTER: ADISHWAR AUTO),136,2024-01-01,TWO WHEELER
GUANGXI MEIBAO(IMPORTER: DYNAMO ELECTRIC),14,2024-01-01,TWO WHEELER
HARLEY DAVIDSON (IMPORTER: HERO MOTOCORP),246,2024-01-01,TWO WHEELER
H-D MOTOR COMPANY INDIA PVT LTD,3,2024-01-01,TWO WHEELER
HERO ELECTRIC VEHICLE PVT LTD,1,2024-01-01,TWO WHEELER
HERO ELECTRIC VEHICLES PVT. LTD,2916,2024-01-01,TWO WHEELER
HERO HONDA MOTORS LTD,69,2024-01-01,TWO WHEELER
HERO MOTOCORP LTD,5494904,2024-01-01,TWO WHEELER
HOMFEEL VEGH AUTOMOBILES PVT LTD,8,2024-01-01,TWO WHEELER
HONDA MOTORCYCLE AND SCOOTER INDIA (P) LTD,4801238,2024-01-01,TWO WHEELER
HONGKONG WANGYUAN (IMPORTER:POWERTRANS MOBILITY),1,2024-01-01,TWO WHEELER
HONGKONG YIXING (IMPORTER: ADMS MARKETING),318,2024-01-01,TWO WHEELER
HONGKONG YIXING (IMPORTER: VICTORY ELECTRIC),4,2024-01-01,TWO WHEELER
HOP ELECTRIC MOBILITY PVT LTD,355,2024-01-01,TWO WHEELER
HOUSTAN INNOVATION LLP,5,2024-01-01,TWO WHEELER
HSU DRAGON (IMPORTER: DARK FIGHT POWER PVT LTD),1,2024-01-01,TWO WHEELER
IDEAL JAWA INDIA PVT LTD,2,2024-01-01,TWO WHEELER
IGOWISE MOBILITY PVT LTD,9,2024-01-01,TWO WHEELER
INDIA KAWASAKI MOTORS PVT LTD,3727,2024-01-01,TWO WHEELER
INDIA YAMAHA MOTOR PVT LTD,661054,2024-01-01,TWO WHEELER
IRA EDUTECH PVT LTD,11,2024-01-01,TWO WHEELER
IVOOMI INNOVATION PVT LTD,1115,2024-01-01,TWO WHEELER
IZANAU ELECTRIC LLP,24,2024-01-01,TWO WHEELER
JEEVAA E-BIKE MFG PVT LTD,5,2024-01-01,TWO WHEELER
JIANGSU AIMA (IMPORTER: FUTURE EV),55,2024-01-01,TWO WHEELER
JIANGSU AIMA (IMPORTER: QUANTUM ENERGY),16,2024-01-01,TWO WHEELER
JIANGSU DALONG (IMPORTER: ENGTIAN ELECTRIC),4,2024-01-01,TWO WHEELER
JIANGSU DALONG (IMPORTER: KINGCHE MOBILITY),10,2024-01-01,TWO WHEELER
JIANGSU DALONG (IMPORTER: SABOO TOR),33,2024-01-01,TWO WHEELER
JIANGSU DALONG (IMPORTER:TYLOS ELECTRIC VEHICLES),12,2024-01-01,TWO WHEELER
JIANGSU DALONG JIANHAO (IMPORTER: GREEN INDIA),1,2024-01-01,TWO WHEELER
JIANGSU GUOWEI (IMPORTER:ELECTRO-TECH),7,2024-01-01,TWO WHEELER
JIANGSU GUOWEI (IMPORTER: REVEAL ELECTRIC),20,2024-01-01,TWO WHEELER
JIANGSU JINPENG (IMPORTER:RAFT MOTORS P. LTD),36,2024-01-01,TWO WHEELER
JIANGSU SUNHOU (IMPORTER: SABOO TOR),5,2024-01-01,TWO WHEELER
JIANGSU XINRI E-VEHICLE(IMPORTER SWIFT CUR.TECH.),13,2024-01-01,TWO WHEELER
JIANGSU XINRI (IMPORTER: NISIKI TECHNOLOGIES),2,2024-01-01,TWO WHEELER
JIANGSU ZHEENAIDA (IMPORTER: KLB GLOBAL),147,2024-01-01,TWO WHEELER
JITENDRA NEW EV-TECH PVT. LTD,932,2024-01-01,TWO WHEELER
JUNENG MOTORCYCLE (IMPORTER: ADMS MARKETING),60,2024-01-01,TWO WHEELER
JUNENG MOTORCYCLE (IMPORTER: ISCOOT MOTERS),144,2024-01-01,TWO WHEELER
JUNENG MOTORCYCLE (IMPORTER: JHEV MOTORS PVT LTD),100,2024-01-01,TWO WHEELER
JUNENG MOTORCYCLE TECH. (IMPORTER: DELTA AUTOCORP),31,2024-01-01,TWO WHEELER
KABIRA MOBILITY LLP,33,2024-01-01,TWO WHEELER
KAINING (HONGKONG) (IMPORTER: COMPTECH MOTOCORP),141,2024-01-01,TWO WHEELER
KAINING (HONGKONG) (IMPORTER: ENERGY AUTOMOBILE),19,2024-01-01,TWO WHEELER
KAINING (HONGKONG) (IMPORTER: ENIGMA AUTOMOBILES),19,2024-01-01,TWO WHEELER
KAINING (HONGKONG) (IMPORTER:M/S IZANAU ELECTRIC),22,2024-01-01,TWO WHEELER
KAINING (HONGKONG) (IMPORTER:RAILIES MOTO),5,2024-01-01,TWO WHEELER
KAINING (HONGKONG) (IMPORTER: TOXMO ELECTRIC),2,2024-01-01,TWO WHEELER
KAINING (HONGKONG) (IMPORTER: VOLTA EV PVT LTD),5,2024-01-01,TWO WHEELER
KINETIC GREEN ENERGY & POWER SOLUTIONS LTD,11460,2024-01-01,TWO WHEELER
KLB KOMAKI PVT LTD,3570,2024-01-01,TWO WHEELER
KTM MOTORRAD AG,2,2024-01-01,TWO WHEELER
KYTE ENERGY PVT. LTD.,408,2024-01-01,TWO WHEELER
LECTRIX E VEHICLES PVT LTD,5255,2024-01-01,TWO WHEELER
LIMA VEHICLE GROUP(IMPORTER: ROUTE & MARS EV LLP),2,2024-01-01,TWO WHEELER
LORDS AUTOMATIVE PVT LTD,4,2024-01-01,TWO WHEELER
MAC INTERNATIONAL (IMPORTER:HONESTY),1,2024-01-01,TWO WHEELER
MAC INTERNATIONAL (IMPORTER: JHEV MOTORS PVT LTD),45,2024-01-01,TWO WHEELER
MAC INTERNATIONAL (IMPORTER: SUNDAK SOLAR),1,2024-01-01,TWO WHEELER
MAHINDRA ELECTRIC MOBILITY LIMITED,1,2024-01-01,TWO WHEELER
MAHINDRA & MAHINDRA LIMITED,5,2024-01-01,TWO WHEELER
MARUTHISAN PVT LTD,143,2024-01-01,TWO WHEELER
MARUTI SUZUKI INDIA LTD,10,2024-01-01,TWO WHEELER
MATTER MOTOR WORKS PVT LTD,24,2024-01-01,TWO WHEELER
MAULIRAJ INDUSTRIES LLP,1,2024-01-01,TWO WHEELER
MECPOWER MOBILITY PVT. LTD.,240,2024-01-01,TWO WHEELER
MERCURY EV TECH LTD,2,2024-01-01,TWO WHEELER
MEW ELECTRICALS LIMITED,7,2024-01-01,TWO WHEELER
MICROAUTOTECH PVT. LTD.,3,2024-01-01,TWO WHEELER
MIRAKLE 5 AUTOMOBILES PVT LTD,17,2024-01-01,TWO WHEELER
MODIKA INTERNATIONAL (IMPORTER: FRANKLIN EV),31,2024-01-01,TWO WHEELER
MOTOVOLT MOBILITY PVT LTD,310,2024-01-01,TWO WHEELER
NANJING VMOTO (IMPORTER: FORTUNEV),1,2024-01-01,TWO WHEELER
NDS ECO MOTORS PVT LTD,13,2024-01-01,TWO WHEELER
NINGBO LONGJIA (IMPORTER: ADISHWAR AUTO),143,2024-01-01,TWO WHEELER
NINGBO SANJIANG (IMPORTER: VABRO EVTECH),46,2024-01-01,TWO WHEELER
NISIKI TECHNOLOGIES PVT LTD,28,2024-01-01,TWO WHEELER
NUMEROS MOTORS PVT LTD,282,2024-01-01,TWO WHEELER
OBEN ELECTRIC VEHICLES PVT LTD,634,2024-01-01,TWO WHEELER
ODYSSE ELECTRIC VEHICLES PVT LTD,1534,2024-01-01,TWO WHEELER
OKAYA EV PVT LTD,6104,2024-01-01,TWO WHEELER
OKINAWA AUTOTECH PVT LTD,4855,2024-01-01,TWO WHEELER
OLA ELECTRIC TECHNOLOGIES PVT LTD,407692,2024-01-01,TWO WHEELER
OMJAY EV LIMITED,14,2024-01-01,TWO WHEELER
OTHERS,270,2024-01-01,TWO WHEELER
OZOTEC AUTOMOBILE PRIVATE LIMITED,103,2024-01-01,TWO WHEELER
PIAGGIO VEHICLES PVT LTD,34821,2024-01-01,TWO WHEELER
POLARIS INDIA PVT LTD,16,2024-01-01,TWO WHEELER
PORFITEL TECHNOLOGY (IMPORTER: AERORIDE),106,2024-01-01,TWO WHEELER
PORWAL ELECTRIC,6,2024-01-01,TWO WHEELER
PUR ENERGY PVT LTD,5539,2024-01-01,TWO WHEELER
QIANJIANG-KEEWAY (IMPORTER: ADISHWAR AUTO),684,2024-01-01,TWO WHEELER
QICHENG VEHICLE (IMPORTER: AUTOICARE INNOVATION),28,2024-01-01,TWO WHEELER
QOOKEE TECHNOLOGIES (IMPORTER:VIKEBIKE INDIA),28,2024-01-01,TWO WHEELER
QUANTUM ENERGY LTD.,5612,2024-01-01,TWO WHEELER
REGENERATION E BIKES,9,2024-01-01,TWO WHEELER
REVOLT INTELLICORP PVT LTD,9955,2024-01-01,TWO WHEELER
RGM BUSINESS PLUS PVT LTD,248,2024-01-01,TWO WHEELER
RIVER MOBILITY PVT LTD,2515,2024-01-01,TWO WHEELER
ROWWET MOBILITY PVT LTD,331,2024-01-01,TWO WHEELER
ROYAL AUTOMOBILES,1,2024-01-01,TWO WHEELER
ROYAL-ENFIELD (UNIT OF EICHER LTD),816792,2024-01-01,TWO WHEELER
SAI SAMEER POWER ELECTRIC VEHICLES PVT LTD,7,2024-01-01,TWO WHEELER
SBTEK E MOTO PVT LTD,11,2024-01-01,TWO WHEELER
SEEKA E MOTORS PVT LTD,15,2024-01-01,TWO WHEELER
SHEMA E- VEHCILE & SOLAR PVT LTD,1568,2024-01-01,TWO WHEELER
SIMPLEENERGY PVT LTD,1419,2024-01-01,TWO WHEELER
SMAP VEHICLES (IMPORTER: ELEGO MOTORS),8,2024-01-01,TWO WHEELER
SMARDA INDUSTRY (IMPORTER: RHYNO),4,2024-01-01,TWO WHEELER
SOKUDO ELECTRIC INDIA PVT LTD,418,2024-01-01,TWO WHEELER
SRIVARU MOTORS PVT LTD,3,2024-01-01,TWO WHEELER
SUMEC CO LTD (IMPORTER: ROUTE & MARS EV LLP),1,2024-01-01,TWO WHEELER
SUPERECO AUTOMOTIVE CO,20,2024-01-01,TWO WHEELER
SUPERTECH EV LIMITED,1,2024-01-01,TWO WHEELER
SUZUKI MOTORCYCLE INDIA PVT LTD,957241,2024-01-01,TWO WHEELER
TATA MOTORS PASSENGER VEHICLES LTD,1,2024-01-01,TWO WHEELER
THUKRAL ELECTRIC BIKES PVT LTD,11,2024-01-01,TWO WHEELER
TORK MOTORS PVT LTD,943,2024-01-01,TWO WHEELER
TRIUMPH MOTORCYCLES (INDIA) PVT LTD,1072,2024-01-01,TWO WHEELER
TUNWAL E MOTORS PVT LTD,16,2024-01-01,TWO WHEELER
TVS MOTOR COMPANY LTD,3249876,2024-01-01,TWO WHEELER
TYST DRIVE INDIA PVT LTD,6,2024-01-01,TWO WHEELER
ULTRAVIOLETTE AUTOMOTIVE PVT LTD,408,2024-01-01,TWO WHEELER
VELOCIFERO (IMPORTER: KAWVELOCE MOTORS PVT LTD),3,2024-01-01,TWO WHEELER
VINTAGE VEHICLES,1,2024-01-01,TWO WHEELER
WARDWIZARD INNOVATIONS & MOBILITY LIMITED,10923,2024-01-01,TWO WHEELER
WARIVO MOTOR INDIA PVT LTD,118,2024-01-01,TWO WHEELER
WHITE CARBON MOTORS PVT LTD,22,2024-01-01,TWO WHEELER
WUXI DONGMA (IMPORTER: DYNAM PRECISION),6,2024-01-01,TWO WHEELER
WUXI JIYAYI (IMPORTER: IZANAU ELECTRIC LLP),99,2024-01-01,TWO WHEELER
WUXI MAYA (IMPORTER: DYNAMO ELECTRIC P. LTD.),95,2024-01-01,TWO WHEELER
WUXI NOOMA (IMPORTER: KKL HITECH EV),1,2024-01-01,TWO WHEELER
WUXI NOOMA (IMPORTER: SMARTNK ELECTRIC VEHICLE),8,2024-01-01,TWO WHEELER
WUXI SAIGE ELECTRIC (IMPORTER: DELTA AUTOCORP LLP),133,2024-01-01,TWO WHEELER
WUXI SAIGE ELECTRIC (IMPORTER: GLORIOUS DIGITAL),3,2024-01-01,TWO WHEELER
WUXI SAIGE (IMPORTER: DM GREEN ENERGY),34,2024-01-01,TWO WHEELER
WUXI SAIGE (IMPORTER: ELECTRO-TECH),9,2024-01-01,TWO WHEELER
WUXI SAIGE (IMPORTER: E-VISHWA ELECTOBIKE),4,2024-01-01,TWO WHEELER
WUXI SAIGE (IMPORTER: KKL HITECH EV),3,2024-01-01,TWO WHEELER
WUXI SAIGE (IMPORTER: NGAGE IMPEX),16,2024-01-01,TWO WHEELER
WUXI SAIGE (IMPORTER: WARIVO MOTOR),332,2024-01-01,TWO WHEELER
WUXI SAIGE (IMPORTER: ZELIO AUTO PVT.LTD.),26,2024-01-01,TWO WHEELER
WUXI SHENGBAO (IMPORTER:ELECTRIC ONE ENERGY),74,2024-01-01,TWO WHEELER
WUXI SHENGBAO (IMPORTER:SHEMA E-VEHICLE),52,2024-01-01,TWO WHEELER
WUXI TENGHUI (IMPORTER: BOHRE ELECTRIC),6,2024-01-01,TWO WHEELER
WUXI TENGHUI (IMPORTER: FEZORA INDIA),21,2024-01-01,TWO WHEELER
WUXI TENGHUI (IMPORTER: FLYCON MOTORS),211,2024-01-01,TWO WHEELER
WUXI TENGHUI (IMPORTER: FRANKLIN EV INDIA),31,2024-01-01,TWO WHEELER
WUXI TENGHUI (IMPORTER: HOP ELECTRIC MOBILITY),198,2024-01-01,TWO WHEELER
WUXI TENGHUI (IMPORTER: JAIDKA POWER),26,2024-01-01,TWO WHEELER
WUXI TENGHUI (IMPORTER: JOZHI SERVICES),132,2024-01-01,TWO WHEELER
WUXI TENGHUI (IMPORTER: RADHA MOBILITIES LLP),10,2024-01-01,TWO WHEELER
WUXI TENGHUI (IMPORTER: REMARK ELECTRIC),6,2024-01-01,TWO WHEELER
WUXI TENGHUI (IMPORTER: SEEKA E MOTORS),254,2024-01-01,TWO WHEELER
WUXI TENGHUI INTERNATIONAL (IMPORTER: FEZORA),20,2024-01-01,TWO WHEELER
WUXI TENGHUI INTERNATIONAL (IMPORTER: FRANKLIN EV),13,2024-01-01,TWO WHEELER
WUXI TOURWE (IMPORTER: GOREEN E-MOBILITY),339,2024-01-01,TWO WHEELER
WUXI YIZHILING (IMPORTER: HOMFEEL VEGH),40,2024-01-01,TWO WHEELER
XIDAA MOTO PVT LTD,1,2024-01-01,TWO WHEELER
YADEA TECHNOLOGY (IMPORTER: YULU BIKES),11,2024-01-01,TWO WHEELER
YANGGUANG LINGMU (IMPORTER: DAWNGATE BUSINESS),1,2024-01-01,TWO WHEELER
YANGGUANG LINGMU (IMPORTER: ECOINDIA),1,2024-01-01,TWO WHEELER
YANGGUANG LINGMU (IMPORTER: FLYCON MOTORS),119,2024-01-01,TWO WHEELER
YANGGUANG LINGMU (IMPORTER: REMARK ELECTRIC),13,2024-01-01,TWO WHEELER
YANGGUANG LINGMU (IMPORTER: XWLS ELECTRIC),13,2024-01-01,TWO WHEELER
YOUYAKU ELECTRIC (IMPORTER: HOUSTAN INNOVATION),178,2024-01-01,TWO WHEELER
YOUYAKU ELECTRIC (IMPORTER:IME VEHICLES PVT LTD),266,2024-01-01,TWO WHEELER
YOUYAKU ELECTRIC (IMPORTER:KRISHIKA EV INDIA),26,2024-01-01,TWO WHEELER
YOUYAKU ELECTRIC (IMPORTER:NEWTRON ELECTRIC),77,2024-01-01,TWO WHEELER
YOUYAKU ELECTRIC (IMPORTER:ONZO EV),46,2024-01-01,TWO WHEELER
YOUYAKU ELECTRIC (IMPORTER: SASDAL ENTERPRISES),127,2024-01-01,TWO WHEELER
YOUYAKU ELECTRIC (IMPORTER: SHEMA E-VEHICLE),15,2024-01-01,TWO WHEELER
YOUYAKU ELECTRIC (IMPORTER: SMOBILITY EV),72,2024-01-01,TWO WHEELER
YOUYAKU ELECTRIC (IMPORTER: TVISI ELECTRIC),19,2024-01-01,TWO WHEELER
ZAP (HK) (IMPORTER: IZANAU ELECTRIC),69,2024-01-01,TWO WHEELER
ZAP (IMPORTER:ELLYSIUM AUTOMOTIVES PVT LTD),8,2024-01-01,TWO WHEELER
ZELIO AUTO PVT LTD,24,2024-01-01,TWO WHEELER
ZHEJIANG CFMOTO (IMPORTER: ADISHWAR AUTO),31,2024-01-01,TWO WHEELER
ZHEJIANG CHANGLING (IMPORTER: ADISHWAR AUTO),135,2024-01-01,TWO WHEELER
ZHEJIANG LUYUAN (IMPORTER: DYNAM EV TECH),16,2024-01-01,TWO WHEELER
ZHEJIANG MORNI (IMPORTER: ADISHWAR AUTO),38,2024-01-01,TWO WHEELER
ZHEJIANG QIANJIANG (IMPORTER: ADISHWAR AUTO),240,2024-01-01,TWO WHEELER
ZHEJIANG TIANYING (IMPORTER: NEWTRON ELECTRIC),7,2024-01-01,TWO WHEELER
ZHONGHUALONG (IMPORTER: POWORO PVT LTD),124,2024-01-01,TWO WHEELER
ZHONGXING (IMPORTER:GREENO AUTOMOBILE),9,2024-01-01,TWO WHEELER
3EV INDUSTRIES PVT LTD,70,2024-01-01,THREE WHEELER
3S INDUSTRIES PRIVATE LIMITED,1274,2024-01-01,THREE WHEELER
AADHYA ENTERPRISES,571,2024-01-01,THREE WHEELER
AADITYA GARBAGE PRODUCTS PVT LTD,5,2024-01-01,THREE WHEELER
AAHANA COMMERCE PVT LTD,2912,2024-01-01,THREE WHEELER
AAKK AUTO PVT LTD,60,2024-01-01,THREE WHEELER
AARGEE ELECTRIC,10,2024-01-01,THREE WHEELER
AARON INDUSTRIES,27,2024-01-01,THREE WHEELER
ACCRETION POWER AUTOS,502,2024-01-01,THREE WHEELER
ADAPT MOTORS PVT LTD,1,2024-01-01,THREE WHEELER
ADIDEV TECHNOA PVT LTD,1687,2024-01-01,THREE WHEELER
ADITYA SAI INDUSTRIES,204,2024-01-01,THREE WHEELER
ADM TECHNOLOGIES PVT. LTD.,305,2024-01-01,THREE WHEELER
AERODRIVE PVT LTD,12,2024-01-01,THREE WHEELER
AFKON AUTOMOTIVES PVT LTD,165,2024-01-01,THREE WHEELER
AGRAWAL RENEWABLE ENERGY PVT LTD,3,2024-01-01,THREE WHEELER
AJAY MOTORS PRIVATE LIMITED,195,2024-01-01,THREE WHEELER
A.J ENTERPRISES,166,2024-01-01,THREE WHEELER
AKG INTERNATIONAL,1837,2024-01-01,THREE WHEELER
A K GUPTA & CO.,685,2024-01-01,THREE WHEELER
ALBEDO VISION PVT LTD,6,2024-01-01,THREE WHEELER
ALIED E MOBILITY PVT LTD,71,2024-01-01,THREE WHEELER
ALLENTTI MOTORS PVT LTD,265,2024-01-01,THREE WHEELER
ALLFINE INDUSTRIES PVT LTD,9290,2024-01-01,THREE WHEELER
ALTIER ELECTRIC VEHICLES PVT LTD,2926,2024-01-01,THREE WHEELER
ALTIGREEN PROPULSION LABS PVT LTD,1084,2024-01-01,THREE WHEELER
ALTIUS TECHNOLOGIES,11,2024-01-01,THREE WHEELER
ALVI AUTO,14,2024-01-01,THREE WHEELER
AMAN AUTOMOBILES,74,2024-01-01,THREE WHEELER
AMAN ELECTRIC VEHICLES,532,2024-01-01,THREE WHEELER
AMBIKA ENTERPRISES,117,2024-01-01,THREE WHEELER
AMBIKA INDUSTRIES,1880,2024-01-01,THREE WHEELER
AMIR KHAN SAIFI STEEL WORKS,21,2024-01-01,THREE WHEELER
ANJALI AUTO COMPONENTS,60,2024-01-01,THREE WHEELER
ANJALI TRADERS,107,2024-01-01,THREE WHEELER
ANOOP CYLINDERS PVT LTD,9,2024-01-01,THREE WHEELER
APARNA INDUSTRIES,37,2024-01-01,THREE WHEELER
A P I MOTORS PVT LTD,598,2024-01-01,THREE WHEELER
APM AUTO SALES,675,2024-01-01,THREE WHEELER
APSARA ENTERPRISE,1551,2024-01-01,THREE WHEELER
ARCHIT ENTERPRISES,1333,2024-01-01,THREE WHEELER
ARD EXIM,41,2024-01-01,THREE WHEELER
ARIHANT ENTERPRISES,1,2024-01-01,THREE WHEELER
A.R. MOTOR,462,2024-01-01,THREE WHEELER
ARNA ELECTRIC AUTO PVT LTD,86,2024-01-01,THREE WHEELER
ARROW AUTOMOTIVE,3433,2024-01-01,THREE WHEELER
ARYAN INDUSTRIES,3,2024-01-01,THREE WHEELER
ASAV AUTOMOTIVE PVT LTD,7,2024-01-01,THREE WHEELER
ASHA IMPEX,251,2024-01-01,THREE WHEELER
ASHLESHA POWER CONTROLS PVT LTD,3,2024-01-01,THREE WHEELER
ASHMA-MOTORS PVT LTD,1389,2024-01-01,THREE WHEELER
ASHWA ELECTRIC,1,2024-01-01,THREE WHEELER
ATTOLENT AUTO GROUP PVT LTD,631,2024-01-01,THREE WHEELER
ATUL AUTO LTD,27080,2024-01-01,THREE WHEELER
ATUL GREENTECH PRIVATE LIMITED,765,2024-01-01,THREE WHEELER
ATUT SANGAM,2490,2024-01-01,THREE WHEELER
AUTOECO GREEN ENERGY PVT LTD,855,2024-01-01,THREE WHEELER
AUTOHAUS PRIVATE LIMITED,3,2024-01-01,THREE WHEELER
AUTOLITE (INDIA) LIMITED,1,2024-01-01,THREE WHEELER
A.V.AUTOMOTIVES PVT LTD,1512,2024-01-01,THREE WHEELER
AVL ELECTRIC VEHICLES PVT LTD,3462,2024-01-01,THREE WHEELER
AVON CYCLES LTD,640,2024-01-01,THREE WHEELER
B24 ROKET EV,1207,2024-01-01,THREE WHEELER
BABA E-VEHICLES,785,2024-01-01,THREE WHEELER
BADSHAH ENTERPRISES,23,2024-01-01,THREE WHEELER
BAGHWAN RIKSHAW UDYOG,47,2024-01-01,THREE WHEELER
BAJAJ AUTO LTD,438903,2024-01-01,THREE WHEELER
BAJAJ IMPLEMENTS PVT. LTD,869,2024-01-01,THREE WHEELER
BALAJI TRADING COMPANY,125,2024-01-01,THREE WHEELER
BALAN ENGINEERING PVT LTD,127,2024-01-01,THREE WHEELER
BAL GOPAL WHEELS PVT LTD,132,2024-01-01,THREE WHEELER
BALI AUTO INDUSTRIES,265,2024-01-01,THREE WHEELER
BAXY LTD,4884,2024-01-01,THREE WHEELER
BEENA DEVI & SONS INDUSTRIES PVT LTD,1,2024-01-01,THREE WHEELER
BENTINCK INDUSTRIES PVT. LTD.,232,2024-01-01,THREE WHEELER
BEST WAY AGENCIES PVT LTD,6076,2024-01-01,THREE WHEELER
BESTWAY BANARASH,11,2024-01-01,THREE WHEELER
BHADAURIA ENTERPRISES,109,2024-01-01,THREE WHEELER
BHAVE ELECTRIC VEHICLES PVT LTD,2449,2024-01-01,THREE WHEELER
BHM INDUSTRIES,2530,2024-01-01,THREE WHEELER
BIG BULL TRADER PVT LTD,3031,2024-01-01,THREE WHEELER
BIJNOR ENTERPRISES,32,2024-01-01,THREE WHEELER
BOSS ENTERPRISES,43,2024-01-01,THREE WHEELER
BRIGHT AUTOZONE PVT LTD,3006,2024-01-01,THREE WHEELER
BRIGHT METAL WORKS,1,2024-01-01,THREE WHEELER
BRIGHT SAFAR,26,2024-01-01,THREE WHEELER
BSERAIL ENGINEERING PVT LTD,85,2024-01-01,THREE WHEELER
CAPCO INDUSTRIES PVT LTD,38,2024-01-01,THREE WHEELER
CAPITAL AUTO INDUSTRIES,1766,2024-01-01,THREE WHEELER
CARREE YUNUS VEHICLE PVT LTD,62,2024-01-01,THREE WHEELER
CART INDIA,440,2024-01-01,THREE WHEELER
CEEON INDIA,590,2024-01-01,THREE WHEELER
CELLETRON MOTOR WORKS,172,2024-01-01,THREE WHEELER
CG & BROTHER CO,10,2024-01-01,THREE WHEELER
CHAMPION POLY PLAST,11200,2024-01-01,THREE WHEELER
CHANDAKE-AUTOMOBILES LLP,145,2024-01-01,THREE WHEELER
CHAUHAN AUTO INDUSTRIES,603,2024-01-01,THREE WHEELER
CHEHAK BATTERIES,386,2024-01-01,THREE WHEELER
CITADEL ENTERPRISES(OPC) PVT LTD,12,2024-01-01,THREE WHEELER
CITYGREEN AUTO & PETRO CHEMICALS (P) LTD,552,2024-01-01,THREE WHEELER
CLENERGY INNOVATIONS PVT LTD,4,2024-01-01,THREE WHEELER
C M OVERSEAS,28,2024-01-01,THREE WHEELER
CONTINENTAL ENGINES PVT LTD,744,2024-01-01,THREE WHEELER
COVAI GREEN RIDE,4,2024-01-01,THREE WHEELER
CYRUS AUTO INDUSTRIES PVT LTD,47,2024-01-01,THREE WHEELER
DAKSH INDUSTRIES,7141,2024-01-01,THREE WHEELER
DASHMESH TRADERS,149,2024-01-01,THREE WHEELER
DAVE EXIM PVT LTD,227,2024-01-01,THREE WHEELER
DEBU AUTOMOBILES,9,2024-01-01,THREE WHEELER
DEEP DRAWN TECHNOLOGIES,30,2024-01-01,THREE WHEELER
DE EUSI MOTORS PVT LTD.,1978,2024-01-01,THREE WHEELER
DELTA AUTOCORP LTD,1874,2024-01-01,THREE WHEELER
DELTEK ENTERPRISES PVT LTD,31,2024-01-01,THREE WHEELER
DEVAM ELECTRIC VEHICLES PVT LTD,149,2024-01-01,THREE WHEELER
DEVCHHAYA MOTORS,4,2024-01-01,THREE WHEELER
DEV MOTORS,1095,2024-01-01,THREE WHEELER
